{
  "$schema": "https://json-schema.org/draft/2020-12/schema",
  "$id": "https://github.com/openteams-ai/frame-spec/spec/schema/frame-document.schema.json",
  "title": "Frame (document serializations: YAML and JSON)",
  "description": "Schema for a Frame written as a whole document: a single mapping whose members are the metadata fields, with the body carried as the 'body' string. Covers both defined document serializations, YAML and JSON, because YAML parses into the same data model — validate the parsed document. One schema rather than two, so the two cannot drift apart. This is the same Frame shape the frontmatter schema describes, with the body included as data. Extension fields are permitted.",
  "type": "object",
  "required": ["type", "name", "description", "visibility"],
  "additionalProperties": true,
  "properties": {
    "type": {
      "$comment": "Required. The self-identifying hook. Exactly 'frame', or 'frame [<major>.<minor>]'. The bracketed token names the spec conformance family; patch-qualified tokens such as 'frame [0.2.0]' are not valid. Note that the document serializations are defined by the working draft targeting v0.3, so a YAML or JSON Frame that declares a version should declare 'frame [0.3]' or later.",
      "type": "string",
      "pattern": "^frame(?: \\[[0-9]+\\.[0-9]+\\])?$",
      "examples": ["frame", "frame [0.3]"]
    },
    "name": {
      "$comment": "Required. Short human-readable name for the Frame.",
      "type": "string",
      "minLength": 1
    },
    "description": {
      "$comment": "Required. One or two sentences on what the Frame is for and when it should be used.",
      "type": "string",
      "minLength": 1
    },
    "visibility": {
      "$comment": "Required. Not a closed set: the spec suggests these four values but does not restrict the field to them, so this is 'examples' rather than 'enum'. In YAML, note that an unquoted 'yes' or 'no' parses as a boolean in YAML 1.1 parsers and fails this string constraint.",
      "type": "string",
      "minLength": 1,
      "examples": ["private", "internal", "shared", "public"]
    },
    "version": {
      "$comment": "Recommended. The Frame's own revision, not the spec version. The spec does not mandate a versioning scheme, so no pattern is enforced. In YAML, quote it: an unquoted 'version: 1.2' parses as a number and fails this string constraint, which is the intended behavior rather than a schema bug.",
      "type": "string",
      "minLength": 1,
      "examples": ["0.1.0", "1.2.0", "2026-08-20"]
    },
    "scope": {
      "$comment": "Recommended. Where the Frame applies. The spec defines no formal scope grammar.",
      "type": "string",
      "minLength": 1,
      "examples": ["company", "department", "project", "partner", "personal"]
    },
    "maintainer": {
      "$comment": "Recommended. Person, team, or organization that maintains the Frame.",
      "type": "string",
      "minLength": 1
    },
    "inherits": {
      "$comment": "Recommended. One parent Frame as a string, or several as an array. Earlier entries have lower precedence than later ones; the child always wins. Values are references an implementation can resolve, typically a path, name, or URI. Parents may be written in a different serialization.",
      "oneOf": [
        {
          "type": "string",
          "minLength": 1
        },
        {
          "type": "array",
          "minItems": 1,
          "uniqueItems": true,
          "items": {
            "type": "string",
            "minLength": 1
          }
        }
      ]
    },
    "body": {
      "$comment": "Optional, and the part that carries the value. Free-form human-readable text, conventionally Markdown. In YAML, write it as a literal block scalar ('body: |') so line breaks survive verbatim and nothing needs escaping. The spec defines no required sections and no section taxonomy, so nothing about its content is constrained here. An empty or absent body validates and conveys nothing.",
      "type": "string"
    }
  }
}
